{
  "id": "625dae5f8f66eb001c7ef330",
  "username": "Krillan",
  "name": "",
  "honor": 29714,
  "clan": "",
  "leaderboardPosition": 184,
  "skills": [],
  "ranks": {
    "overall": {
      "rank": 1,
      "name": "1 dan",
      "color": "black",
      "score": 38060
    },
    "languages": {
      "ruby": {
        "rank": -1,
        "name": "1 kyu",
        "color": "purple",
        "score": 28600
      },
      "sql": {
        "rank": -3,
        "name": "3 kyu",
        "color": "blue",
        "score": 3015
      },
      "javascript": {
        "rank": -2,
        "name": "2 kyu",
        "color": "purple",
        "score": 6801
      },
      "shell": {
        "rank": -5,
        "name": "5 kyu",
        "color": "yellow",
        "score": 416
      }
    }
  },
  "codeChallenges": {
    "totalAuthored": 2,
    "totalCompleted": 4377
  }
}